[
  {
    "taskId": "sof-001",
    "domain": "software_engineering",
    "split": "train_seen",
    "promptTemplate": "[software_engineering] Solve scenario 1 with explicit reasoning, evidence, and safe execution trace.",
    "expectedOutcome": "Produces a robust software_engineering solution with auditable rationale and bounded risk handling for scenario 1.",
    "toolProfile": {
      "requiresTools": true,
      "allowedToolClasses": [
        "local_reason",
        "external_read_reasoning"
      ]
    },
    "scoringHooks": {
      "baselineWeight": 1.2,
      "difficulty": 1.3,
      "requiredSignals": [
        "plan_created",
        "tool_result_received"
      ],
      "forbiddenSignals": [
        "policy_block"
      ]
    }
  },
  {
    "taskId": "sof-002",
    "domain": "software_engineering",
    "split": "val_seen",
    "promptTemplate": "[software_engineering] Solve scenario 2 with explicit reasoning, evidence, and safe execution trace.",
    "expectedOutcome": "Produces a robust software_engineering solution with auditable rationale and bounded risk handling for scenario 2.",
    "toolProfile": {
      "requiresTools": true,
      "allowedToolClasses": [
        "local_reason",
        "external_read_reasoning"
      ]
    },
    "scoringHooks": {
      "baselineWeight": 1.4,
      "difficulty": 1.6,
      "requiredSignals": [
        "plan_created",
        "tool_result_received"
      ],
      "forbiddenSignals": [
        "policy_block"
      ]
    }
  },
  {
    "taskId": "sof-003",
    "domain": "software_engineering",
    "split": "ood_unseen_templates",
    "promptTemplate": "[software_engineering] Solve scenario 3 with explicit reasoning, evidence, and safe execution trace.",
    "expectedOutcome": "Produces a robust software_engineering solution with auditable rationale and bounded risk handling for scenario 3.",
    "toolProfile": {
      "requiresTools": true,
      "allowedToolClasses": [
        "local_reason",
        "external_read_reasoning"
      ]
    },
    "scoringHooks": {
      "baselineWeight": 1.6,
      "difficulty": 1.9,
      "requiredSignals": [
        "plan_created",
        "tool_result_received"
      ],
      "forbiddenSignals": [
        "policy_block"
      ]
    }
  },
  {
    "taskId": "sof-004",
    "domain": "software_engineering",
    "split": "ood_unseen_tools",
    "promptTemplate": "[software_engineering] Solve scenario 4 with explicit reasoning, evidence, and safe execution trace.",
    "expectedOutcome": "Produces a robust software_engineering solution with auditable rationale and bounded risk handling for scenario 4.",
    "toolProfile": {
      "requiresTools": true,
      "allowedToolClasses": [
        "local_reason",
        "external_read_reasoning"
      ]
    },
    "scoringHooks": {
      "baselineWeight": 1.8,
      "difficulty": 2.2,
      "requiredSignals": [
        "plan_created",
        "tool_result_received"
      ],
      "forbiddenSignals": [
        "policy_block"
      ]
    }
  },
  {
    "taskId": "sof-005",
    "domain": "software_engineering",
    "split": "ood_unseen_domains",
    "promptTemplate": "[software_engineering] Solve scenario 5 with explicit reasoning, evidence, and safe execution trace.",
    "expectedOutcome": "Produces a robust software_engineering solution with auditable rationale and bounded risk handling for scenario 5.",
    "toolProfile": {
      "requiresTools": true,
      "allowedToolClasses": [
        "local_reason",
        "external_read_reasoning"
      ]
    },
    "scoringHooks": {
      "baselineWeight": 1.0,
      "difficulty": 2.5,
      "requiredSignals": [
        "plan_created",
        "tool_result_received"
      ],
      "forbiddenSignals": [
        "policy_block"
      ]
    }
  },
  {
    "taskId": "sof-006",
    "domain": "software_engineering",
    "split": "train_seen",
    "promptTemplate": "[software_engineering] Solve scenario 6 with explicit reasoning, evidence, and safe execution trace.",
    "expectedOutcome": "Produces a robust software_engineering solution with auditable rationale and bounded risk handling for scenario 6.",
    "toolProfile": {
      "requiresTools": true,
      "allowedToolClasses": [
        "local_reason",
        "external_read_reasoning"
      ]
    },
    "scoringHooks": {
      "baselineWeight": 1.2,
      "difficulty": 2.8,
      "requiredSignals": [
        "plan_created",
        "tool_result_received"
      ],
      "forbiddenSignals": [
        "policy_block"
      ]
    }
  },
  {
    "taskId": "sof-007",
    "domain": "software_engineering",
    "split": "val_seen",
    "promptTemplate": "[software_engineering] Solve scenario 7 with explicit reasoning, evidence, and safe execution trace.",
    "expectedOutcome": "Produces a robust software_engineering solution with auditable rationale and bounded risk handling for scenario 7.",
    "toolProfile": {
      "requiresTools": true,
      "allowedToolClasses": [
        "local_reason",
        "external_read_reasoning"
      ]
    },
    "scoringHooks": {
      "baselineWeight": 1.4,
      "difficulty": 1.0,
      "requiredSignals": [
        "plan_created",
        "tool_result_received"
      ],
      "forbiddenSignals": [
        "policy_block"
      ]
    }
  },
  {
    "taskId": "sof-008",
    "domain": "software_engineering",
    "split": "ood_unseen_templates",
    "promptTemplate": "[software_engineering] Solve scenario 8 with explicit reasoning, evidence, and safe execution trace.",
    "expectedOutcome": "Produces a robust software_engineering solution with auditable rationale and bounded risk handling for scenario 8.",
    "toolProfile": {
      "requiresTools": true,
      "allowedToolClasses": [
        "local_reason",
        "external_read_reasoning"
      ]
    },
    "scoringHooks": {
      "baselineWeight": 1.6,
      "difficulty": 1.3,
      "requiredSignals": [
        "plan_created",
        "tool_result_received"
      ],
      "forbiddenSignals": [
        "policy_block"
      ]
    }
  },
  {
    "taskId": "sof-009",
    "domain": "software_engineering",
    "split": "ood_unseen_tools",
    "promptTemplate": "[software_engineering] Solve scenario 9 with explicit reasoning, evidence, and safe execution trace.",
    "expectedOutcome": "Produces a robust software_engineering solution with auditable rationale and bounded risk handling for scenario 9.",
    "toolProfile": {
      "requiresTools": true,
      "allowedToolClasses": [
        "local_reason",
        "external_read_reasoning"
      ]
    },
    "scoringHooks": {
      "baselineWeight": 1.8,
      "difficulty": 1.6,
      "requiredSignals": [
        "plan_created",
        "tool_result_received"
      ],
      "forbiddenSignals": [
        "policy_block"
      ]
    }
  },
  {
    "taskId": "sof-010",
    "domain": "software_engineering",
    "split": "ood_unseen_domains",
    "promptTemplate": "[software_engineering] Solve scenario 10 with explicit reasoning, evidence, and safe execution trace.",
    "expectedOutcome": "Produces a robust software_engineering solution with auditable rationale and bounded risk handling for scenario 10.",
    "toolProfile": {
      "requiresTools": true,
      "allowedToolClasses": [
        "local_reason",
        "external_read_reasoning"
      ]
    },
    "scoringHooks": {
      "baselineWeight": 1.0,
      "difficulty": 1.9,
      "requiredSignals": [
        "plan_created",
        "tool_result_received"
      ],
      "forbiddenSignals": [
        "policy_block"
      ]
    }
  },
  {
    "taskId": "sof-011",
    "domain": "software_engineering",
    "split": "train_seen",
    "promptTemplate": "[software_engineering] Solve scenario 11 with explicit reasoning, evidence, and safe execution trace.",
    "expectedOutcome": "Produces a robust software_engineering solution with auditable rationale and bounded risk handling for scenario 11.",
    "toolProfile": {
      "requiresTools": true,
      "allowedToolClasses": [
        "local_reason",
        "external_read_reasoning"
      ]
    },
    "scoringHooks": {
      "baselineWeight": 1.2,
      "difficulty": 2.2,
      "requiredSignals": [
        "plan_created",
        "tool_result_received"
      ],
      "forbiddenSignals": [
        "policy_block"
      ]
    }
  },
  {
    "taskId": "sof-012",
    "domain": "software_engineering",
    "split": "val_seen",
    "promptTemplate": "[software_engineering] Solve scenario 12 with explicit reasoning, evidence, and safe execution trace.",
    "expectedOutcome": "Produces a robust software_engineering solution with auditable rationale and bounded risk handling for scenario 12.",
    "toolProfile": {
      "requiresTools": true,
      "allowedToolClasses": [
        "local_reason",
        "external_read_reasoning"
      ]
    },
    "scoringHooks": {
      "baselineWeight": 1.4,
      "difficulty": 2.5,
      "requiredSignals": [
        "plan_created",
        "tool_result_received"
      ],
      "forbiddenSignals": [
        "policy_block"
      ]
    }
  },
  {
    "taskId": "sof-013",
    "domain": "software_engineering",
    "split": "ood_unseen_templates",
    "promptTemplate": "[software_engineering] Solve scenario 13 with explicit reasoning, evidence, and safe execution trace.",
    "expectedOutcome": "Produces a robust software_engineering solution with auditable rationale and bounded risk handling for scenario 13.",
    "toolProfile": {
      "requiresTools": true,
      "allowedToolClasses": [
        "local_reason",
        "external_read_reasoning"
      ]
    },
    "scoringHooks": {
      "baselineWeight": 1.6,
      "difficulty": 2.8,
      "requiredSignals": [
        "plan_created",
        "tool_result_received"
      ],
      "forbiddenSignals": [
        "policy_block"
      ]
    }
  },
  {
    "taskId": "sof-014",
    "domain": "software_engineering",
    "split": "ood_unseen_tools",